{
  "version": 3,
  "id": "def-globo-dialogo-v1",
  "kind": "prop",
  "canvas": { "width": 1080, "height": 1920 },
  "pivot": { "x": 540, "y": 900 },
  "variants": [
    {
      "id": "coral", "outputId": "globo-dialogo-coral-v1", "label": "Globo de diálogo coral",
      "palette": { "outline": "#25170f", "bubble": "#ff7169", "highlight": "#fff0dd", "dot": "#25170f", "shadow": "#0812254d" }
    },
    {
      "id": "azul", "outputId": "globo-dialogo-azul-v1", "label": "Globo de diálogo azul",
      "palette": { "outline": "#13203e", "bubble": "#6f8cff", "highlight": "#e9f8ff", "dot": "#13203e", "shadow": "#0812254d" }
    }
  ],
  "parts": [
    {
      "id": "shadow", "parentId": null, "pivot": { "x": 540, "y": 900 }, "zIndex": 0,
      "shapes": [{ "type": "ellipse", "cx": 540, "cy": 1240, "rx": 315, "ry": 54, "fill": "$shadow" }]
    },
    {
      "id": "bubble", "parentId": "shadow", "pivot": { "x": 540, "y": 900 }, "zIndex": 1,
      "shapes": [
        { "type": "rect", "x": 170, "y": 540, "width": 740, "height": 520, "rx": 150, "fill": "$bubble", "stroke": "$outline", "strokeWidth": 24 },
        { "type": "polygon", "points": [{ "x": 660, "y": 1020 }, { "x": 820, "y": 1190 }, { "x": 760, "y": 980 }], "fill": "$bubble", "stroke": "$outline", "strokeWidth": 24 },
        { "type": "path", "d": "M 300 690 C 360 610 470 590 580 605", "fill": "#ffffff00", "stroke": "$highlight", "strokeWidth": 34, "lineCap": "round" },
        { "type": "ellipse", "cx": 405, "cy": 820, "rx": 38, "ry": 38, "fill": "$dot" },
        { "type": "ellipse", "cx": 540, "cy": 820, "rx": 38, "ry": 38, "fill": "$dot" },
        { "type": "ellipse", "cx": 675, "cy": 820, "rx": 38, "ry": 38, "fill": "$dot" }
      ]
    }
  ],
  "parameters": [],
  "bindings": [],
  "provenance": { "source": "Definición geométrica original creada para el paquete visual interno V1.", "license": "Asset propietario original del proyecto." }
}
